{
  "packet_id": "pkt_alpha_2026",
  "packet_version": "1.0.0",
  "created_at": "2026-06-19T09:00:00Z",
  "updated_at": "2026-06-19T17:30:00Z",
  "engagement_label": "Client Alpha - initial inventory assessment",
  "assessment_stage": "discovery",
  "client_intake": {
    "intake_id": "intake_alpha_2026",
    "created_at": "2026-06-15T14:30:00Z",
    "created_by": "consultant_a",
    "client_profile": {
      "organization_label": "client_alpha",
      "organization_type": "distributor",
      "size_indicator": "medium",
      "locations_count_indicator": "few",
      "geographies": ["north_america"]
    },
    "industry": "industrial parts distribution",
    "operating_model": "make-to-stock distribution from a central warehouse to regional branches",
    "inventory_environment": {
      "product_categories": ["fasteners", "fittings", "safety_equipment"],
      "storage_types": ["racked", "bulk", "small_parts_bins"],
      "sku_count_indicator": "tens_of_thousands",
      "throughput_indicator": "moderate",
      "inventory_value_indicator": "high"
    },
    "known_systems": [
      { "name": "ERP", "category": "ERP", "role": "system of record for stock and orders", "notes": "aging on-premise deployment" },
      { "name": "spreadsheets", "category": "spreadsheet", "role": "branch-level reorder tracking", "notes": "maintained per branch, not integrated" }
    ],
    "stated_pain_points": [
      {
        "description": "Frequent stockouts on fast-moving SKUs despite reported stock on hand",
        "impact_indicator": "high",
        "evidence_references": ["evid_alpha_001"]
      },
      {
        "description": "Physical counts routinely disagree with the ERP",
        "impact_indicator": "high",
        "evidence_references": ["evid_alpha_002"]
      }
    ],
    "stakeholders": [
      { "role": "operations_manager", "anonymized_label": "stakeholder_1", "involvement": "primary sponsor" },
      { "role": "warehouse_lead", "anonymized_label": "stakeholder_2", "involvement": "day-to-day operations" },
      { "role": "finance_controller", "anonymized_label": "stakeholder_3", "involvement": "inventory valuation" }
    ],
    "urgency": {
      "level": "high",
      "business_trigger": "an external stock-count audit flagged material discrepancies"
    },
    "available_data_sources": [
      { "name": "ERP stock-on-hand export", "type": "system_export", "availability": "on_request" },
      { "name": "last cycle-count report", "type": "report", "availability": "available" },
      { "name": "branch reorder spreadsheets", "type": "spreadsheet", "availability": "restricted" }
    ],
    "initial_scope_hypothesis": "Inventory record accuracy is being eroded by uncontrolled adjustments and unreconciled branch processes; focus the assessment on counting discipline and adjustment controls.",
    "first_billing_tranche_objective": "Deliver an evidence-based initial assessment that quantifies record-accuracy issues and identifies quick wins, positioning a scoped next-phase remediation engagement.",
    "assessment_readiness": {
      "status": "partially_ready",
      "blockers": ["ERP export access pending IT approval", "branch spreadsheet access restricted"],
      "notes": "Site walk-around can proceed while data access is arranged."
    },
    "evidence_references": ["evid_alpha_001", "evid_alpha_002"],
    "consultant_notes": "Sponsor is motivated by the audit finding; move quickly on the walk-around to build early evidence."
  },
  "inventory_system_profile": {
    "system_profile_id": "isp_alpha_2026",
    "related_intake_id": "intake_alpha_2026",
    "known_systems": [
      { "name": "ERP", "category": "ERP", "role": "system of record for stock, purchasing, and orders", "notes": "on-premise, limited internal reporting flexibility" },
      { "name": "branch reorder spreadsheets", "category": "spreadsheet", "role": "branch-level reorder point tracking", "notes": "one per branch, maintained manually, not integrated with the ERP" }
    ],
    "records_source_of_truth": {
      "system_name": "ERP",
      "confidence": "low",
      "notes": "Nominally the ERP, but staff trust physical counts more, and branches rely on their own spreadsheets for reordering."
    },
    "integrations": [
      { "description": "Branch spreadsheets are reconciled to the ERP by manual re-keying", "integration_type": "manual", "reliability": "low" }
    ],
    "manual_workarounds": [
      { "description": "Branches maintain separate reorder spreadsheets because they do not trust ERP availability figures", "workflow_area": "replenishment", "evidence_references": ["evid_alpha_002"] }
    ],
    "reporting_outputs": [
      { "name": "stock-on-hand export", "purpose": "purchasing decisions", "source_system": "ERP" },
      { "name": "cycle-count report", "purpose": "count reconciliation", "source_system": "ERP" }
    ],
    "data_quality_concerns": [
      { "description": "On-hand balances diverge from physical counts across many SKUs", "data_domain": "counts", "severity": "high", "evidence_references": ["evid_alpha_002"] },
      { "description": "Negative on-hand balances are not flagged or prevented by the ERP", "data_domain": "transactions", "severity": "medium", "evidence_references": [] }
    ],
    "access_status": {
      "status": "partial",
      "notes": "ERP read access requested and pending IT approval; branch spreadsheets restricted pending management sign-off."
    },
    "evidence_references": ["evid_alpha_002"],
    "consultant_notes": "Multiple competing sources of truth is a core theme; confirm once ERP export is available."
  },
  "evidence_references": [
    {
      "evidence_id": "evid_alpha_001",
      "evidence_type": "interview_statement",
      "source_type": "stakeholder",
      "collection_method": "interview",
      "collected_at": "2026-06-18T09:40:00Z",
      "collected_by": "consultant_a",
      "related_object_ids": ["intake_alpha_2026"],
      "summary": "Operations manager reported frequent stockouts on fast-moving SKUs even when the ERP shows stock on hand, and said purchasing no longer trusts on-hand figures.",
      "reliability": "medium",
      "confidence_notes": "Sponsor's account; consistent with the audit trigger but not yet quantified from data.",
      "access_notes": "Captured in intake-call notes; no recording retained.",
      "sensitive_data_flag": false,
      "consultant_notes": "Quantify stockout frequency once the ERP export is available."
    },
    {
      "evidence_id": "evid_alpha_002",
      "evidence_type": "interview_statement",
      "source_type": "stakeholder",
      "collection_method": "interview",
      "collected_at": "2026-06-18T10:05:00Z",
      "collected_by": "consultant_a",
      "related_object_ids": ["intake_alpha_2026", "intv_alpha_wh_lead"],
      "summary": "Warehouse lead reported that physical cycle counts 'almost always' disagree with the ERP, and that discrepancies are resolved by manually adjusting the ERP to match the count without root-cause review.",
      "reliability": "medium",
      "confidence_notes": "First-hand account from the person performing counts; not yet corroborated against count records.",
      "access_notes": "Verbal statement captured in interview notes; no recording retained.",
      "retention_notes": "Interview notes held by consultant; formal retention policy to be defined in a later phase.",
      "sensitive_data_flag": false,
      "consultant_notes": "Corroborate against the last cycle-count report and the adjustment log once ERP access is granted."
    },
    {
      "evidence_id": "evid_alpha_003",
      "evidence_type": "photograph",
      "source_type": "site_walk",
      "collection_method": "photograph",
      "collected_at": "2026-06-18T13:20:00Z",
      "collected_by": "consultant_a",
      "related_object_ids": ["intake_alpha_2026", "vobs_alpha_binspill"],
      "summary": "Photographs of small-parts bin zones showing faded/missing location labels and bins holding mixed SKUs without partition labels.",
      "reliability": "high",
      "confidence_notes": "Direct photographic evidence taken during the walk-around.",
      "access_notes": "Image files retained by consultant; not embedded here.",
      "sensitive_data_flag": false,
      "consultant_notes": "Strong support for the bin-labeling quick win."
    }
  ],
  "stakeholder_interviews": [
    {
      "interview_id": "intv_alpha_wh_lead",
      "related_intake_id": "intake_alpha_2026",
      "stakeholder_role": "warehouse_lead",
      "stakeholder_label": "stakeholder_2",
      "interviewed_at": "2026-06-18T10:00:00Z",
      "interviewer": "consultant_a",
      "topics_covered": ["counting process", "adjustments", "receiving", "system usage"],
      "stated_pain_points": [
        { "description": "Counts rarely match the ERP, and there is no time to investigate why", "evidence_references": ["evid_alpha_002"] }
      ],
      "process_claims": [
        { "claim": "Cycle counts are done weekly but only on a subset of aisles chosen informally", "workflow_area": "cycle_count", "evidence_references": ["evid_alpha_002"] },
        { "claim": "Received goods are sometimes put away before being booked into the ERP", "workflow_area": "receiving", "evidence_references": [] }
      ],
      "system_claims": [
        { "claim": "The ERP does not flag negative on-hand balances, so they go unnoticed", "system_name": "ERP", "evidence_references": [] }
      ],
      "quantified_impacts": [
        { "description": "Time spent reconciling counts each week", "metric": "hours_per_week", "reported_value": "6-8", "unit": "hours", "evidence_references": ["evid_alpha_002"] }
      ],
      "contradictions_or_followups": [
        { "description": "Operations manager stated counts are full-warehouse monthly; warehouse lead describes partial weekly. Reconcile the actual counting cadence.", "type": "contradiction" },